id;nombre;categoria;precio;imagen
7790060023684;ACEITE COCINERO GIRASOL X 1.5 LTS;;6080;
7790070012050;ACEITE COCINERO GIRASOL X 900 ML;;3860;
7796613306730;ACEITE DE OLIVA EXT VIRGEN M&K X 500CC;;14710;
7790272001029;ACEITE NATURA X 1.5;;6960;
7790272001036;ACEITE NATURA X 3 LTS;;14320;
7790272001005;ACEITE NATURA X 900 ML;;4400;
7790070228611;ACETO COCINERO X 500ML;;6470;
7790070265463;ADERESO P/ ENSALADA COCINERO CLASICO X500ML;;2690;
785;ALMOHADITA DE ARROZ NATURPLAN FRUTILLA X 280GR;;1460;
7791120100208;ARROZ APOSTOLES LARGO FINO X 500GR;;775;
7790070433145;ARROZ GALLO LARGO FINO X 500 GR;;1230;
7794580000040;ARROZ MOCOVI LARGO FINO X 500 GR;;1160;
7792350067019;ARVEJAS INALPA LATA X 300GR;;700;
7796613021404;ATUN M&K DESM AL NATURAL X 170 GR;;1680;
7796613304569;ATUN M&K EN TROZOS AL NATURAL X 170 GR;;3320;
7796613304576;ATÚN M&K EN TROZOS EN ACEITE Y AGUA X 170 GR;;3320;
7792540260138;AZUCAR LEDESMA X 1 KG;;1590;
7796613024337;AZUCAR M&K TIPO A X 1KG;;1470;
7790150430392;BICARBONATO DE SODIO ALICANTE X 50 G;;600;
3;BISCOCHITOS  X KG;;10500;
7794000009318;BOLSA P/HORNO KNORR FINAS HIERBAS X 21GR;;3100;
7794000004924;BOLSA P/HORNO KNORR TIPO CRIOLLO X 21GR;;3100;
7796613002502;CABALLA M&K AL NATURAL X 380 GR;;6430;
7796613002496;CABALLA M&K EN ACEITE X 380 GR;;6430;
7790070936493;CAFE ARLISTAN X 100 GR;;4890;
7790150100486;CAFE INST LA VIRGINIA CLASICO X 170GR;;9660;
7790150006320;CAFE LA VIRGINIA X 250GR;;6970;
7790150006351;CAFE LA VIRGINIA X 500 GR;;13930;
7794000008588;CALDO DE VERDURAS KNORR X 2U;;760;
7794000008595;CALDO DE VERDURAS KNORR X 6;;1440;
7792350067040;CHOCLO AMARILLO CREMOSO INALPA X 350;;950;
7792350067057;CHOCLO BLANCO CREMOSO INALPA X 350 GR;;825;
7792350067033;CHOCLO INALPA AMARILLO ENTERO X 300GR;;1360;
7794820903124;CHOCOLATADA MILKAUT X 1 LT;;3760;
7794820004159;CHOCOLATADA MILKAUT X 200ML;;1080;
7794820902967;CREMA DE LECHE MILKAUT X 325GR;;4110;
7797457010210;DISCO DE ARROZ GREATING S/SAL X 100GR;;1260;
7794820902028;DULCE DE LECHE MILKAUT X 245GR;;2520;
7796613024566;DURAZNOS AMARILLOS M&K LT X 820GR;;2680;
7790036020211;EDULCORANTE SI DIET X 500 ML;;2860;
125;EMPANADAS ABUELA ELVIRA X 1;;1520;
13;FACTURAS STA ISABEL;;740;
4;FACTURAS Y BIZCOCHOS;;750;
7798154060010;FIDEOS ABUELO DOMINGO MORRON Y ESPINACA X 400 GR;;1660;
7798031155624;FIDEOS KNORR AVE MARIA X 500 GR;;1500;
7798031155648;FIDEOS KNORR DEDALITOS X 500 GR;;1560;
7798031155587;FIDEOS KNORR RIGATTI X 500;;1490;
7798031155532;FIDEOS KNORR SPAGHETTI X 500;;1650;
7798031155662;FIDEOS KNORR TIRABUZON X 500 GR;;1780;
7797470199251;FIDEOS MAROLIO MOSTACHOL LISO X 500GR;;920;
7798138553231;FIDEOS SANTA ISABEL CODITOS X 500GR;;990;
7798138555440;FIDEOS SANTA ISABEL DEDALES X 500GR;;990;
7798138555518;FIDEOS SANTA ISABEL SPAGHETTI X 500GR;;990;
7790150811061;FILTRO DE PAPEL Nº 4 LA VIRGINIA X 40;;4660;
7796613007910;GARBANZO M&K X 400GR;;1850;
7792350067071;GARBANZOS INALPA X 350 GR;;940;
7622300865566;GELATINA ROYAL DURAZNO X 40 GR;;1322;
7622201819668;GELATINA ROYAL FRAMBUESA X 40 GR;;940;
7622300865535;GELATINA ROYAL FRUTILLA X 40 GR;;940;
7793591002081;GRASA LA CORDOBESA X 500 GR;;2110;
7793040000361;HAMBURGUESA FRIAR FINITAS X 2U;;1380;
7798341460012;HAMBURGUESA LA MUÑECA X 2U;;3040;
7790079020780;HAMBURGUESA PALADINI + GRANDE X 2U;;1152;
7790079023354;HAMBURGUESA PALADINI + RAPIDAS X 2;;2340;
7790079020704;HAMBURGUESA PALADINI X 2;;3780;
535;HAMBURGUESA PATY X 2;;2800;
7798341460043;HAMBURGUEZA LA MUÑECA MAS GRANDE X 2U;;4620;
7790070562180;HARINA BLANCAFLOR LEUDANTE X 1 KG;;1730;
7792180134516;HARINA PUREZA 100% INTEGRAL X 1KG;;2060;
7792180141941;HARINA PUREZA P/PIZZA MASA MADRE X 1KG;;2740;
566;HILERET STEVIA X 1SOB;;60;
476;HILERET SWEET X 1 SOBRE;;40;
7794940000840;HILERET SWEET X 400 ML;;5810;
7792350067026;JARDINERA INALPA X 300GR;;1055;
7622202236846;JUGO CLIGHT LIMONADA ARANDANOS X 8 GRS;;490;
7622300872892;JUGO CLIGHT LIMONADA C/STEVIA X 7.5 GR;;311;
7622210969811;JUGO CLIGHT LIMONADA MENTA JENGIBRE X 8 GRS;;311;
7622201704148;JUGO CLIGHT MANDARINA X 8GR;;490;
7622300859756;JUGO CLIGHT MANGO-PERA X 6.5GR;;311;
7622300863043;JUGO CLIGHT MANZANA DELICIOSA X 7.5GR;;311;
7622201703080;JUGO CLIGHT MANZANA DELICIOSA X 7GR;;490;
7622201807733;JUGO CLIGHT MANZANA VERDE X 7.5GR;;490;
7622300655556;JUGO CLIGHT MARACUYÁ DE BRASIL;;311;
7622201706135;JUGO CLIGHT NARANJA DULCE PACK X 8U;;695;
7622201703110;JUGO CLIGHT NARANJA X 8G;;490;
7622201703202;JUGO CLIGHT PERA X 7GR;;490;
7622201807528;JUGO CLIGHT POM. ROSADO X 8 GR;;490;
7622201703233;JUGO CLIGHT POMELO AMARILLO X 8GR;;490;
7622201703172;JUGO CLIGHT POMELO ROSADO X 8GR;;490;
7622201704551;JUGO CLIGHT STEVIA NARANJA  X 9.5GR;;311;
7796613310393;JUGO DE LIMON M&K X 960ML;;2360;
7622201745967;JUGO TANG ANANA X 15GR;;460;
7622202012082;JUGO TANG BALANCE LIMONADA X 7GR;;320;
7622202012129;JUGO TANG BALANCE NARANJA X 7GR;;320;
7622201745936;JUGO TANG DURAZNO X 15GR;;460;
7622300864149;JUGO TANG FRESH FRUTILLA X 25 GR;;306;
7622201746490;JUGO TANG FRUTILLA X 15GR;;450;
7622300826987;JUGO TANG LIMONADA;;467;
7622201735685;JUGO TANG LIMONADA DULCE X 20 GR;;470;
7622201733865;JUGO TANG MANDARINA X 15GR;;470;
7622201717377;JUGO TANG MANZANA PACK X 8U;;750;
7622201816735;JUGO TANG MIX NAR-MARAC-FRUT X 18GR;;467;
7622201735715;JUGO TANG MULTIFRUTA X 15GR;;460;
7622201735777;JUGO TANG NARANJA- BANANA X 15GR;;460;
7622201735340;JUGO TANG NARANJA DULCE X 15GR;;470;
7622201746018;JUGO TANG NARANJA-LIMA X 15GR;;470;
7622201735746;JUGO TANG POMELO ROSADO X 18GR;;460;
7622201746117;JUGO TANG UVA X 18GR;;450;
7622201717414;JUGO VERAO NARANJA X 10GR;;240;
7794000006188;KETCHUP HELLMANNS X 250GR;;2300;
7793913013009;LECHE DESC TREGAR 0%LACTOSA LV X 1LT;;3440;
8445291020047;LECHE EN POLVO DESC SVELTY DP X 370GR;;9180;
452;LENGUITAS BETY;;2300;
7792350067064;LENTEJAS INALPA X 300GR;;1200;
7798018850184;LEVADURA LEVEX X 2 SOBRES;;1335;
7796613304583;LOMITOS DE ATUN M&K AL NATURAL X 170 GR;;3710;
7796613304590;LOMITOS DE ATUN M&K EN ACEITE X 170 GR;;3710;
7796613007941;MAIZ PISINGALLO M&K X 400 GR;;1248;
7794000007451;MAIZENA DURYEA X 200 GR;;2530;
7791118013206;MALTA EL POCILLO X 115GR;;3440;
7798085370080;MANTECA 1ER PREMIO X 200 GR;;3640;
7790387800081;MATE COCIDO UNION DIAMANTADO S/E X 25U;;1520;
7791866000558;MAYONESA CADA DIA LIVIANA X 250;;1160;
7791866000565;MAYONESA CADA DIA X 125GR;;520;
7791866000572;MAYONESA CADA DIA X 500 GR;;2240;
7794000006553;MAYONESA HELLMANS AJO X 250GR;;2660;
7794000009431;MAYONESA HELLMANS ASADO X 250GR;;2660;
7794000008915;MAYONESA HELLMANS PICANTE X 250GR;;3010;
7791866001357;MAYONESA NATURA DP X 1 KG;;6900;
7791866001197;MAYONESA NATURA X 125;;860;
7791866001203;MAYONESA NATURA X 250 GR;;1800;
7791866001364;MAYONESA NATURA X 500 GR;;3520;
7790079020773;MEDALLONES DE POLLO PALADINI C/ESP Y QUESOI X 2U;;2800;
7790079019708;MEDALLONES DE POLLO PALADINI J Y Q X 2;;3110;
7790079019692;MEDALLONES DE POLLO PALADINI X 150 GR;;2480;
7798035710096;MERMELADA BRUCOR NARANJA X 454GR;;2520;
7793046008453;MERMELADA DULCOR DAMASCO X 454GR;;2450;
7793046008415;MERMELADA DULCOR DURAZNO X 454GR;;2450;
7793046008491;MERMELADA DULCOR FRUTILLA X 454GR;;3130;
629;MIEL POLIMIEL POTE X 500 GR;;4590;
7790079020810;MILANESA DE SOJA CLASICAS PALADINI X 2U;;1610;
7790079020858;MILANESA DE SOJA PALADINI C/ESP Y QUESO X 2U;;2240;
7790070507358;MINERVA X 1LT;;6740;
7790070507341;MINERVA X 500 CM;;3500;
7790079019913;MINI MORTADELA C/QUESO PALADINI X 300GR;;4670;
7790150532706;MIX A LAS BRASAS ALICANTE X 25GR;;1010;
7790150532300;MIX CRIOLLO ALICANTE X 25GR;;1010;
7790150533109;MIX PARRILLA CHIMI AHUMADO ALICANTE X 25GR;;1440;
7790150533000;MIX PARRILLA HAMBURGUESAS ALICANTE X 25GR;;1410;
7790150533154;MIX PARRILLA VEGETALES AHUMADOS ALICANTE X 25GR;;1440;
7790150532201;MIX PICANTE ALICANTE X 25GR;;1010;
8445291082212;NESCAFE DOLCA FCO X 170 GR;;11650;
8445291082137;NESCAFE DOLCA SUAVE FCO X 170GR;;14310;
8445291121867;NESQUIK X 180 GR;;1930;
8445291121881;NESQUIK X 360 GR;;3410;
7798122400015;PALITOS SABORIZADOS TIN;;1960;
764;PALMERITAS BETY X 200GR;;5010;
7793890261219;PAN BIMBO C/LINO EN RODAJAS X 420GR;;6650;
7793890261196;PAN BIMBO INTEGRAL CHICO X 420GR;;6650;
7793890260885;PAN BIMBO TIPO ARTESANO X 500 GR;;8680;
780;PAN BLANCO C/SEMILLAS BETY;;4050;
10;PAN CASERO O ROSCA STA ANA;;2250;
7798432870065;PAN CON SALVADO BETY EN RODAJAS;;3320;
7793890253610;PAN CON SALVADO BRIOSH X 350 GR;;115;
7798432870287;PAN DE MIGA BETY C/SALVADO X 8;;4620;
7798432870157;PAN DE MIGA BETY X 8;;4480;
803;PAN DE PAPA BETY GDE;;1580;
7793890253283;PAN FARGO MIX CEREAL X 430GR;;4910;
7793890259360;PAN FARGO SALVADO PLUS X 600GR;;2980;
58;PAN HAMBURGUESA SUELTO;;510;
7798432870034;PAN HAMBURGUESAS BETY X 4;;2030;
7798432870119;PAN LACTAL BETY EN RODAJAS;;3220;
7798432870058;PAN PANCHOS BETY X 6;;2030;
57;PAN PEBETE SUELTO;;380;
2;PAN SANTA ISABEL X KG;;3680;
416;PAN TORPEDO BETY X 2;;4760;
104;PAN TORPEDO BETY X 3;;2795;
1;PAN X KG;;3150;
7798092963305;PAPEL MANTECA MAKE X 5 MTS;;1640;
7793821980394;PEPAS INT. REG ROSARINO BATATA C/SEMILLAS;;2330;
7790360720115;PICADILLO SWIFT X 90 GR;;1150;
7793984000168;PIONONO CONDESA X 400GR;;2165;
745;PIZZETA BETY X 6;;4110;
7796613007903;POROTOS ALUBIA M&K X 500GR;;2850;
7792350004595;POROTOS INALPA X 350 GR;;940;
7790150570340;PROVENZAL ALICANTE X 50 GR;;1370;
7794000004146;PURE DE PAPAS KNORR X 125 GR;;2550;
7791564013355;QUESITO ADLER GRUYERE X 100 GR;;2620;
7791564012488;QUESITO ADLER JAMÓN 2 X 50GR;;2620;
7791564012495;QUESITO ADLER QUESO AZUL X 100 GR;;2570;
7791564012501;QUESO ADLER FONTINA 2 X 50GR;;2620;
7791564012525;QUESO ADLER SALAME 2 X 50GR;;2620;
7793890261271;RAPIDITAS INTEGRAL BIMBO X 220GR;;3500;
7798021650740;RAVIOLES C/CARNE Y VERDURA LP X 500 GR;;1850;
7798021650764;RAVIOLES DE POLLO Y VERD LA PIAMONTESA  X 500 GR;;3070;
7798021650092;RAVIOLES DE RICOTA  LA PIAMONTESA X 500 G;;3990;
7790272000831;ROCIO VEGETAL NATURA X 120 GR;;4385;
7794000004917;SABOR AL HORNO KNORR AJO Y CEBOLLA X 21GR;;2160;
7794000004887;SABOR AL HORNO KNORR LIMON Y OREGANO X 21GR;;2160;
7790072001014;SAL FINA CELUSAL X 500 GR;;1540;
7791004000822;SAL GRUESA CELUSAL X 500GR;;1400;
7790079000317;SALCHICHA FELA X 6;;1570;
7790079010828;SALCHICHAS PALADINI X 6;;2780;
7794000007987;SALSA LISTA KNORR PIZZA X 340GR;;1660;
7794000008007;SALSA LISTA KNORR POMAROLA X 340 GR;;1660;
384;SANDWICH MAXIMIGA 2 TRIPLES JCR R Y Q;;5570;
815;SANDWICH MAXIMIGA MASA MADRE J Y Q X 2U;;7430;
7794000006478;SAVORA DOY PACK X 250 GR;;1600;
7794000005877;SOPA CREMA KNORR DE VEGETALES X 60GR;;2480;
7794000005815;SOPA KNORR VEGETALES C/CARACOLITOS TRICOLOR X 107.5 GR;;2480;
7794000005839;SOPA KNORR VEGETALES CON FIDEOS LETRAS;;2140;
349;TARTA DE POLLO ABUELA ELVIRA;;10500;
7790150310267;TE DE BOLDO LA VIRGINIA X 25U;;2220;
7790150211908;TE LA VIRGINIA EN SAQUITO X 25;;1110;
7790150330166;TE MANZANILLA LA VIRGINIA X 25;;1780;
7790150320266;TE TILO LA VIRGINIA X 25 SAQ;;3210;
695;TIRAMISU/CHOCOTORTA ABUELA ELVIRA;;6600;
7792350068214;TOMATE CUBETEADO INALPA X 400GR;;1220;
7792350068221;TOMATE PELADO PERITA INALPA X 400GR;;1170;
7792350068276;TOMATE TRITURADO INALPA BOT X 950GR;;2190;
7798142880200;TOSTADAS DE ARROZ M DEL BOSQUE INTEGRAL X 150GR;;1790;
7790071070134;TOSTADAS RIERA LIGHT X 200 GR;;1690;
383;VARITAS SABORIZADAS X KG;;13050;
7798016940917;VINAGRE DE ALCOHOL FISCHER PET X 930 CC;;1810;
7798016940702;VINAGRE DE ALCOHOL FISCHER X 500;;1240;
7798016940801;VINAGRE DE MANZANA FISCHER X 500 CM;;1440;
7792710000182;YERBA AMANDA TRADICIONAL X 500 GR;;2210;
7798039850606;YERBA ANDRESITO PREMIUM X 500GR;;1800;
7790710334597;YERBA CBSE LIMON X 500GR;;2010;
7790710334580;YERBA CBSE NARANJA X 500 GR;;1960;
7791680101257;YERBA LA HOJA X 500 GR;;1810;
7790480089734;YERBA LA TRANQUERA TRAD X 500GR;;2360;
7793704000911;YERBA PLAYADITO SUAVE X 500GR;;2700;
7790411001989;YERBA ROSAMONTE SUAVE X 500 GR;;2900;
7790411001958;YERBA ROSAMONTE X 500 GR;;2155;
7790387013627;YERBA TARAGUI FLEX X 500GR;;2140;
7790387014624;YERBA UNION SUAVE FLEX X 500GR;;2000;
7790580132392;ARVEJAS SECAS ARCOR X 350;;1490;
7790580132286;BIZCOCHUELO AGUILA CHOCOLATE X 540GR;;5455;
7790580132293;BIZCOCHUELO AGUILA VAINILLA X 530GR;;4960;
7790580131760;BIZCOCHUELO GODET CHOCOLATE X 480 GR;;4790;
7790580131753;BIZCOCHUELO GODET MARMOLADO X 500 GR;;4570;
7790580131746;BIZCOCHUELO GODET VAINILLA X 480 GR;;4060;
7790580148980;CHOCLO ARCOR AMARILLO ENTERO X 300GR;;2400;
7790040143227;CHOCOLINAS X 170GR;;2060;
7790040143234;CHOCOLINAS X 250GR;;2740;
215;CHUPETINES C/ CHICLE EVOLUTION;;310;
214;CHUPETINES MISTER POP!S Y TROMPITO;;180;
7790040139411;COQUITAS X 157GR;;1235;
7790580134839;FIDEOS MOSTACHOL ARCOR X 500GR;;1970;
7790580145378;FIDEOS TALLARIN ARCOR X 500GR;;1970;
7790580133917;FIDEOS TIRABUZON ARCOR X 500GR;;1970;
7790580145323;FLAN GODET VAINILLA X 25GR;;990;
7790040139961;FORMIS CHOCOLATE/DD LECHE X 102GR;;1490;
7790580144456;GELATINA BC FRAMBUESA LIGHT X 18GR;;1200;
7790580139247;GELATINA BC FRUTILLA LIGHT X 18GR;;1200;
7790580144265;GELATINA GODET FRAMBUESA X 25GR;;1200;
7790580130886;GELATINA GODET FRUTILLA X 25GR;;1200;
7790580144135;GELATINA MOGUL FRUTILLA X 25GR;;1390;
7790580983307;JARDINERA ARCOR X 300 GR;;1360;
7790580143008;JUGO ARCOR NARANJA DULCE X 15GR;;380;
7790580141509;JUGO ARCOR NARANJA-BANANA X 15GR;;380;
7790580142285;JUGO ARCOR POMELO ROSADO X 15GR;;380;
7790040173200;KESITAS ESTUCHE X 125 GR;;2400;
7790580132453;LENTEJAS ARCOR X 350 GR;;1700;
77944405;MENTHOPLUS 2 ACIDOS CEREZA X 27.2 GR;;1010;
77952455;MENTHOPLUS 2 ACIDOS MANZANA X 28GR;;1010;
77983930;MENTHOPLUS 2 DDL X 27.2GR;;1010;
77992499;MENTHOPLUS 2 FRUTILLA X 27.2GR;;970;
77944412;MENTHOPLUS ACIDO NARANJA X 27.2 GR;;1010;
77955111;MENTHOPLUS CAFE LATTE X 3.5GR;;1010;
77958662;MENTHOPLUS MENTA X 29.4GR;;740;
77958624;MENTHOPLUS MENTOL X 29.4GR;;740;
77946805;MENTHOPLUS S/ AZUCAR CEREZA;;980;
77946812;MENTHOPLUS S/ AZÚCAR DURAZNO;;1010;
77946829;MENTHOPLUS S/ AZUCAR MENTOL;;980;
77901095;MENTHOPLUS STRONG ZERO;;1010;
7790040139657;MERENGADAS FRUTILLA X 88GR;;1720;
7790580132163;MERMELADA ARCOR DURAZNO X 454 GR;;3770;
7790580511500;MERMELADA ARCOR LIGHT CIRUELA X 390GR;;3550;
7790580132224;MERMELADA ARCOR LIGHT DURAZNO FCO X 390 GR;;3550;
7790580132255;MERMELADA ARCOR LIGHT FRUTILLA X 390 GR;;4940;
7790580132262;MERMELADA ARCOR LIGHT NARANJA X 390GR;;3550;
7790580126933;MERMELADA ARCOR NARANJA S/AZUCAR X 390 GR;;5520;
7790580132194;MERMELADA ARCOR NARANJA X 454GR;;3600;
77903501;OPERA X 55 GR;;950;
77903518;OPERA X 92 GR;;1400;
7790580129538;POSTRE GODET CHOCOLATE X 60GR;;1490;
7790580129583;POSTRE GODET VAINILLA X 60GR;;1490;
7790580138738;PRESTOPRONTA ARCOR X 490GR;;1940;
7790580126315;PRESTOPRONTA ESPINACA A LA CREMA X 250GR;;1800;
7790580146115;PURE DE TOMATE ARCOR X 520GR;;1210;
7790040719804;REX ORIGINAL ESTUCHE X 125 GR;;2510;
7790040003569;REX ORIGINAL X 75 GR;;1470;
7790580956509;SALSA ARCOR FILETTO DP X 340 GR;;1360;
7790580133153;SALSA ARCOR PIZZA DP X 340 GR;;1490;
7790040133488;SONRISAS FRAMBUESA X 108GR;;1640;
7790580567101;TOMATE CUBETEADO ARCOR X 400 GR;;1940;
7790580567903;TOMATES PERITAS ARCOR X 400 GR;;1690;
77939753;TOPLINE 7 ATOMIC STRONG X 14 GR;;1030;
77932693;TOPLINE 7 BLOWING MANDARINA X 14GR;;1030;
77983794;TOPLINE 7 BUBBIE FUN X 14GR;;1010;
77964137;TOPLINE 7 FREEZING MENTHOL X 14GR;;1030;
77948588;TOPLINE 7 SANDIA X 14GR;;1030;
7790580138547;TOPLINE 7 TURBO MINT X 50GR;;1936;
77951113;TOPLINE 7 VIBRANT STRAWBERRY X 14.7 GR;;1030;
77948496;TOPLINE 7 VIOLET CHERRY X 14 GR;;1030;
77931764;TOPLINE 7 X-PLOSIVE MINT SIN AZUCAR X 14 GR;;1030;
7790580121013;TOPLINE ULTRA BERRY X 12;;2490;
7790580120573;TOPLINE ULTRA CLEAN MINT X 12U;;2220;
7790580137076;TOPLINE ULTRA DOBLE CITRUS BLUEBERRY X 12;;2220;
7790580120702;TOPLINE ULTRA GREEN MINT X 12;;2220;
7790040124509;TOSTADAS CRIOLLITAS CLASICAS X 195GR;;2030;
7790040124547;TOSTADAS CRIOLLITAS LIGHT X 195GR;;1870;
77993540;TURROCKLETS ARCOR X 25GR;;540;
77940131;TURRON ARCOR X 27 GR;;350;
66;ACEITUNAS CON CAROZO X KG;;11010;
147;ACEITUNAS FILETEADAS X KG;;17290;
275;ACEITUNAS RELLENAS X KG;;14175;
93;ACELGA;;1500;
208;AZUCAR IMPALPABLE SUELTO X KG;;2520;
87;BANANA X KG;;3750;
43;BATATA CON CHOCOLATE DULCOR X KG;;2900;
40;BATATA LISO DULCOR X KG;;3850;
252;BERENJENA X KG;;2250;
9;BONDIOLA PALADINI X KG;;39320;
263;CASCARONES X KG;;22810;
45;CHIZITOS X KG;;7550;
194;CHOCLO X UNIDAD;;1120;
31;CHORIZO DE CERDO MORICONI X KG;;14360;
41;DULCE DE MEMBRILLO DULCOR X KG;;3580;
61;FIDEOS FINOS LA PIAMONTESA X KG;;4280;
62;FIDEOS INTERMEDIO L PIAMONTESA X KG;;4280;
60;FIDEOS TIRABUZON LA PIAMONTESA X KG;;4280;
324;JAMON COCIDO PALADINI X KG;;22380;
366;JAMON CRUDO X KG;;27900;
92;LECHUGA ARREPOLLADA X KG;;4200;
91;LECHUGA DE HOJA;;7200;
44;LEVADURA DE CERVEZA CALSA X KG;;12610;
188;MANDARINAS X KG;;2700;
70;MANI CON CASCARA X KG;;6830;
71;MANI REPELADO SALADO X KG;;7860;
69;MANI SABORIZADO X KG;;8780;
32;MORCILLA MORICONI X KG;;9190;
7;MORTADELA PALADINI X KG;;15530;
428;MOZZARELLA TREMBLAY X KG;;16100;
86;NARANJA X KG;;2400;
63;ÑOQUIS L PIAMONTESA X KG;;4640;
336;PALETA PALADINI X KG;;18560;
162;PALITOS SABORIZADOS X KG;;9660;
213;PALITOS SALADOS X KG;;7620;
135;PALTA X KG;;16800;
256;PANCETA ARROLLADA PALADINI X KG;;29060;
451;PANCETA SALADA PALADINI X KG;;35700;
164;PAPA CORDOBEZA X KG;;1050;
179;PAPAS CONGELADAS NOISETTES X KG;;15600;
64;PAPAS CONGELADAS BASTON X KG;;7615;
55;PAPAS PAY X KG;;15830;
563;PAPITAS ACANALADAS X KG;;15830;
46;PAPITAS X KG;;15830;
424;PEPAS Y SCONES INTEGRAL BETY  X KG;;14000;
68;PICKLES MIXTOS X KG;;8250;
22;QUESO BARRA X KG;;13660;
609;QUESO CHEDDAR MILKAUT FETEADO X KG;;27730;
23;QUESO CREMOSO X KG;;10990;
170;QUESO HOLANDA X KG;;20190;
212;QUESO LS CREMON DOBLE CREMA X KG;;15490;
304;QUESO PARA RALLAR X KG;;24790;
224;QUESO POR SALUT LEILAC X KG;;15430;
503;QUESO ROQUEFORT LEILAC X KG;;21660;
95;REPOLLO BLANCO Y COLORADO X UNIDAD;;2520;
6;SALAME MILAN FELA X KG;;20250;
28;SALAMIN PICADO FINO MORICONI X KG;;26110;
29;SALAMIN PICADO GRUESO MORICONI X KG;;26110;
283;SUPREMAS X KG;;9450;
80;ZANAHORIA X KG;;2400;
7791813434412;7UP FREE X 1.5 LT;;3000;
7791813444473;7UP MEGA 3 L;;3810;
7791813777007;7UP RETORNABLE X 2LT;;2740;
7791813444411;7UP X 1,5 LT;;3670;
7790950001969;AMARGO OBRERO X 950 CM;;5060;
7790895640483;AQUARIUS MANZANA X 1.5 LTS;;3710;
7790895640452;AQUARIUS MANZANA X 500 ML;;1790;
7790895641237;AQUARIUS NARANJA X 1.5 LTS;;3710;
7790895641213;AQUARIUS NARANJA X 500 ML;;1690;
7790895640476;AQUARIUS PERA X 1.5 LTS;;3710;
7790895640445;AQUARIUS PERA X 500 ML;;1790;
7790895640490;AQUARIUS POMELO X 1.5 LTS;;3710;
7790895640469;AQUARIUS POMELO X 500 ML;;1790;
7790036000343;BAGGIO PRONTO DURAZNO X 1L;;2290;
7790036000466;BAGGIO PRONTO MULTIFRUTA X 1 LT;;2290;
7790036000619;BAGGIO PRONTO MULTIFRUTA X 200 ML;;680;
7790036000329;BAGGIO PRONTO NARANJA X 1 LT;;2290;
7790895641534;CEPITA DEL VALLE DURAZNO DEL. X 1.5 L;;3770;
7790895641800;CEPITA DEL VALLE NARANJA TEN X 1.5 LT;;3660;
7792798014934;CERVEZA ANDES ORIGEN ORO LATA X 473CC;;2540;
7792798992317;CERVEZA ANDES ORIGEN ROJA LATA X 473CC;;2220;
7792798014156;CERVEZA ANDES ORIGEN RUBIA LATA X 710CC;;3520;
7792798002115;CERVEZA ANDES ORIGEN RUBIA X 1LT;;4240;
7792798005888;CERVEZA BRAHMA LATA X 473 CC;;2100;
7792798007493;CERVEZA BRAHMA RET X 1LT;;3600;
7793147118822;CERVEZA BUDWEISER LATA X 473 CC;;2110;
7793147001056;CERVEZA BUDWEISER RET X 1LT;;3600;
7891991305679;CERVEZA CORONA CERO X 330ML;;1910;
7792798003709;CERVEZA CORONA X 330CC;;3030;
7792798003716;CERVEZA CORONA X 710 CC;;5080;
7792798009107;CERVEZA QUILMES 0.0% LATA X 473CC;;1690;
7792798013951;CERVEZA QUILMES 1890 LATA X 473CC;;1700;
7792798013937;CERVEZA QUILMES 1890 X 1LT;;3020;
7792798012923;CERVEZA QUILMES LATA X 473 CM;;2000;
7792798014835;CERVEZA QUILMES LATA X 710CC;;2680;
7792798007387;CERVEZA QUILMES RET X 1LT;;3510;
7792798001316;CERVEZA QUILMES STOUT LATA X 473CC;;2000;
7792798013975;CERVEZA STELLA ARTOIS LATA X 710CC;;4470;
7792798010639;CERVEZA STELLA ARTOIS NOIRE LATA X 473CC;;3120;
7792798010561;CERVEZA STELLA ARTOIS X 975;;5190;
7790895000430;COCA COLA DESC X 1.5 LTS;;4310;
7790895000997;COCA COLA DESC X 2.25 LTS;;5670;
7790895000232;COCA COLA LATA X 354ML;;1450;
7790895005374;COCA COLA RET X 1,250 LTS;;2920;
7790895000218;COCA COLA RET X 2 LTS;;3920;
7790895068164;COCA COLA RET X 2.5 LTS;;4470;
7790895000782;COCA COLA X 500 ML;;1830;
7790895067570;COCA COLA ZERO X 2.25 LTS;;5670;
7790895067532;COCA COLA ZERO X 500CC;;1660;
7790895000454;FANTA DESC X 1.5 LTS;;4310;
7790895001017;FANTA DESC X 2.25L;;5670;
7790895000256;FANTA LATA X 354CC;;1450;
7790895006128;FANTA RET X 1.250 LT;;2940;
7790895000331;FANTA RET X 2 LTS;;4150;
7790895000836;FANTA X 500 ML;;1760;
7790290101602;FERNET BRANCA X 750 ML;;19650;
7790950000160;GANCIA X 950 CC;;8760;
7798113301246;GASEOSA MANAOS COLA X 3LT;;2810;
7798113301253;GASEOSA MANAOS LIMA LIMON X 3LT;;2810;
7798113301277;GASEOSA MANAOS POMELO BLANCO X 3LT;;2810;
7791813421917;H2 OH! LIMONETO X 1.5 LTS;;2870;
7791813421603;H2OH! CITRUS X 1.5 LT;;2870;
7791813421382;PASO DE LOS TOROS POMELO X 1.5 LTS;;2980;
7791813222057;PASO DE LOS TOROS TONICA S/A X 1.5LT;;2635;
7791813421368;PASO DE LOS TOROS TONICA X 1.5 LTS;;3130;
7791813828419;PEPSI BLACK S/A X 1.5LT;;2980;
7791813888475;PEPSI MEGA X 3 L;;3790;
7791813888437;PEPSI RETORNABLE X 2LT;;3230;
7791813555049;PEPSI X 1.5 LT;;2950;
7791913000746;PRITTY LIMÓN X 2250 ML;;2870;
7791913001040;PRITTY LIMON X 3L;;3820;
7790154008078;SIDRA 1930 DOLCE X 750CC;;6390;
7798067780029;SODA SIFON CIMES X 2 LT;;1940;
7793861000380;SODA SOCIAL BOT X 1.5LT;;1040;
7790895000447;SPRITE DESC X 1.5 LTS;;4350;
7790895001000;SPRITE DESC X 2.25 LTS;;5730;
7790895006111;SPRITE RET X 1.250 LT;;2940;
7790895000225;SPRITE RET X 2 LTS;;3950;
7790895000829;SPRITE X 500 CC;;1780;
7790950133271;TERMA LIMON X 1,35 L;;2380;
7790950141030;TERMA PATAGONICO CERO X 135LT;;2460;
7790950133356;TERMA PATAGONICO X 1.35LT;;2380;
7790036002132;VIDA BAGGIO MANZANA X 1.5LT;;1840;
7790036002118;VIDA BAGGIO NARANJA X 1.5LT;;1840;
7790314080142;VINO CANCILLER BLEND X 1125ML;;3080;
7790314010842;VINO DILEMA DAY PINK X 750ML;;3080;
7790314056598;VINO ESTANCIA MENDOZA CAB-MALB X 750 ML;;3730;
7790314062896;VINO ESTANCIA MENDOZA RESERVA MALBEC X 750CC;;6470;
7790717152002;VINO NOVECENTO MALBEC X 750ML;;5180;
7790314063848;VINO TORO TETRA BLANCO X 1 LTRO;;2370;
7790314063824;VINO TORO TETRA TTO X 1 LTRO;;2560;
7790314003226;VINO TORO VIEJO 3/4 TTO;;2150;
7790314003233;VINO TORO VIEJO BCO 3/4;;2150;
77988041;CAMEL BOX X 12;;3940;
77977205;CAMEL BOX X 20;;6710;
77977212;CAMEL X 20;;6210;
77983916;CHESTERFIELD BLUE MOTION KS X 20U;;4500;
77953513;CHESTERFIELD WHITE KS X 20;;4790;
77981028;LUCKIES ULP X 20;;2390;
77976994;LUCKY STRIKE CONVERTIBLE 12;;3630;
77990921;LUCKY STRIKE ORIGEN RED X 20;;3630;
77976970;LUCKY STRIKE SILVER KS  X 20U;;5420;
77976505;LUCKY STRIKE X 12;;3520;
77976512;LUCKY STRIKE X 20;;5500;
77988379;LUCKY STRIKE XL CONVERTIBLE BOX X 20;;6110;
77983343;MARLBORO BOX X 12U;;4000;
77993397;MARLBORO CRAFTED FOWARD KS X 20;;3600;
77958099;MARLBORO CRAFTED PURPLE BOX X 20;;3960;
77918482;MARLBORO X 20 BOX;;6650;
77981813;PHILIP MORRIS BOX X 12U;;3600;
77912954;PHILIP MORRIS BOX X 20;;5960;
77971913;PHILIP MORRIS CAPS BOX X 12;;3640;
7790580136062;AJI TRITURADO LA CAMPAGNOLA X 23GR;;1500;
7790580136512;AJI TRITURADO LA CAMPAGNOLA X 48GR;;3030;
7790040133570;ALFAJOR AGUILA MINITORTA BCO X 69GR;;1860;
7790040133594;ALFAJOR AGUILA MINITORTA BROWNIE X 74 GR;;1870;
7790040133587;ALFAJOR AGUILA MINITORTA CLASICO X 69GR;;1870;
7790040133600;ALFAJOR AGUILA MINITORTA COCO X 70.5GR;;1860;
7790040148840;ALFAJOR BON O BON TRIPLE  X 60 G;;1870;
7790040659605;ALFAJOR COFLER BLOCK X 60 GR;;1860;
7790040150010;ALFAJOR COFLER CHOCO CREAMY X 60GR;;1860;
7790040331303;ALFAJOR TATIN BLANCO X 33 GR;;540;
7790040331204;ALFAJOR TATIN NEGRO X 33 GR;;540;
7790040405301;ALFAJOR TATIN TRIPLE BLANCO  X 60 GR;;1150;
7790040405608;ALFAJOR TATIN TRIPLE NEGRO X 60 GR;;1150;
7790580131388;ARCOR SELECCION BOMBONES EN CASA X 228GR;;10120;
7793360132384;ARVEJAS SECAS REMOJ. LA CAMPAGNOLA X 300GR;;1590;
7793360005169;ATUN AL NATURAL LA CAMPAGNOLA X 300 GR;;4695;
7793360129957;ATUN DESMENUZADO DEL MAR LC AL NATURAL;;3460;
7793360129940;ATUN DESMENUZADO DEL MAR LC EN ACEITE X;;3280;
7790580131494;BAÑO DE REPOSTERIA AGUILA BCO X 150 GR;;4150;
7790580127220;BAÑO DE REPOSTERIA AGUILA CELESTE X 150GR;;3700;
7790580131470;BAÑO DE REPOSTERIA AGUILA LECHE X 150 GR;;4240;
7790580125042;BAÑO DE REPOSTERIA AGUILA ROSA X 150 GR;;3700;
7790580131487;BAÑO DE REPOSTERIA AGUILA SEMIAMARGO X 150 GR;;3860;
77965387;BARRA CEREAL MIX YOGHURT FRUTILLA X 26GR;;910;
7790580143800;BARRA COFLER BLOCK X 45GR;;1690;
77955821;BARRITA AGUILA 60% CACAO X 14GR;;1360;
7790580153922;BO O BON SUPREME 8 X 16GR;;8780;
77971944;BOMBON COFLER BLOCK X 16 GR;;680;
77972279;BOMBON TOFI X 15G;;830;
77953537;BON O BON AGUILA X 15GR;;590;
77961815;BON O BON BLANCO X 1;;560;
77958921;BON O BON LECHE X 15GR;;610;
7790580126285;BON O BON SUPREME X 1;;1000;
7790580124557;BON O BON SUPREME X 36GR;;2010;
7790580138585;CABALLA AL NATURAL LA CAMPAGNOLA X 300 GR;;3760;
7790580138578;CABALLA EN ACEITE LA CAMPAGNOLA X 300 GR;;3760;
7790040145023;CEREAL MIX AVENA CHOCOLATE X 207GR;;2510;
7790040135741;CEREAL MIX AVENA Y PASAS X 207GR;;2510;
7790040135765;CEREAL MIX FRUTILLA Y CHIA X 207 GR;;2510;
7790040135758;CEREAL MIX SEMILLAS Y CHIPS X 207GR;;2510;
7790580136215;CHIMICHURRI LA CAMPAGNOLA X 23GR;;1420;
7793360984907;CHOCLO CREMOSO LA CAMPAGNOLA X 300 GR;;2250;
7793360132414;CHOCLO ENTERO AMARILLO LA CAMPAGNOLA X 300GR;;2500;
7790580136031;COMINO MOLIDO LA CAMPAGNOLA X 23GR;;2250;
7790580135980;CONDIMENTO P/ARROZ LA CAMPAGNOLA X 23GR;;1420;
7790580135782;CONDIMENTO P/CARNES LA CAMPAGNOLA X 23GR;;1390;
7790580135737;CONDIMENTO P/PIZZA LA CAMPAGNOLA X 23GR;;1420;
7790580134730;FIDEOS CODITO LA CAMPAGNOLA X 500GR;;2170;
7790580134754;FIDEOS PENNE RIGATE LA CAMPAGNOLA X 500GR;;2170;
7790580134693;FIDEOS SPAGHETTI LA CAMPAGNOLA X 500GR;;2180;
